{
  "$schema": "../schemas/area-contracts.schema.json",
  "schema_version": 1,
  "repo_goal": "Declare the repository goal here so goal-check can compare changed paths against local area contracts.",
  "unknown_policy": "warn",
  "path_contracts": [
    {
      "path": "docs/",
      "purpose": "Repository documentation, runbooks, decisions, and operator-facing guidance.",
      "owner": "repo-owner",
      "source": "AGENTS.md; REVIEW.md; docs/documentation-contract.md",
      "status": "aligned",
      "validation": [
        "make docs-check"
      ]
    },
    {
      "path": ".agent-workflows/",
      "purpose": "Local agent workflow policy, task metadata, run packets, and workflow state.",
      "owner": "repo-owner",
      "source": "docs/ops/agent-workflow.md",
      "status": "aligned",
      "validation": [
        "make agent-task-status"
      ]
    }
  ]
}
